{
  "schemaVersion": 1,
  "temperature": {
    "warmRatio": 0.25,
    "blazingRatio": 0.75
  },
  "fire": {
    "afterglowSeconds": 0.75,
    "emergenceSeconds": 0.55,
    "steadyThresholdSeconds": 0.4,
    "geometry": {
      "sourceWidthScale": 0.28,
      "bodyRadiusPixels": 26,
      "trailRadiusScale": 0.86,
      "tipRadiusScale": 0.28,
      "swayPixels": 13,
      "curlPixels": 14,
      "particleCount": 170,
      "bodyDensity": 0.09,
      "trailDensity": 0.16
    },
    "core": { "color": "#FFF3B0", "alpha": 0.78 },
    "body": { "color": "#FF9F43", "alpha": 0.68 },
    "outer": { "color": "#D94C2B", "alpha": 0.4 },
    "ember": { "color": "#FFCC66", "alpha": 0.82 },
    "emberRate": 54
  },
  "material": {
    "maskScale": 4,
    "edgeFeatherPixels": 2,
    "heatEdgeWidthPixels": 5,
    "charAlpha": 0.72,
    "debrisRate": 42,
    "debrisLifetimeSeconds": 0.24
  },
  "pearls": {
    "medicinalLiquid": {
      "shape": "droplet",
      "motion": "swim",
      "surface": "glossy"
    },
    "slag": {
      "shape": "clump",
      "motion": "tumble",
      "surface": "rough"
    },
    "impurity": {
      "shape": "spike",
      "motion": "jitter",
      "surface": "smoky"
    }
  },
  "failure": {
    "shatteringStartRatio": 0.24,
    "gatheringStartRatio": 0.5,
    "flyingStartRatio": 0.8,
    "shardsPerSource": 4,
    "maximumParticleCount": 96,
    "scatterRadiusPixels": 52,
    "particleRadiusPixels": 5,
    "resultRadiusPixels": 34,
    "furnaceBottomAnchor": { "xRatio": 0.5, "yRatio": 0.84 },
    "resultAnchor": { "xRatio": 0.5, "yRatio": 0.5 }
  },
  "effects": {
    "shieldDurationSeconds": 0.35,
    "damageDurationSeconds": 0.45,
    "steamDurationSeconds": 0.6,
    "warningOneDurationSeconds": 0.8,
    "warningTwoDurationSeconds": 1.1,
    "failureDurationSeconds": 1.25
  },
  "camera": {
    "normalCatchStrength": 0.12,
    "damageStrength": 0.34,
    "fightStrength": 0.24,
    "warningTwoStrength": 0.48,
    "failureStrength": 0.72,
    "durationSeconds": 0.32,
    "maxOffsetPixels": 14
  },
  "audio": {
    "initiallyMuted": true,
    "defaultVolume": 0.65,
    "mergeWindowMs": 45,
    "mergeGain": 1.3,
    "maxVoices": 12,
    "profiles": {
      "fireStart": { "kind": "tone", "attackSeconds": 0.01, "decaySeconds": 0.16, "sustainLevel": 0.35, "releaseSeconds": 0.24, "frequencyHz": 145, "gain": 0.22 },
      "fireLoop": { "kind": "noise", "attackSeconds": 0.12, "decaySeconds": 0.2, "sustainLevel": 0.45, "releaseSeconds": 0.35, "frequencyHz": 95, "gain": 0.12 },
      "fireStop": { "kind": "noise", "attackSeconds": 0.01, "decaySeconds": 0.12, "sustainLevel": 0.08, "releaseSeconds": 0.28, "frequencyHz": 80, "gain": 0.16 },
      "pearlCaught": { "kind": "tone", "attackSeconds": 0.005, "decaySeconds": 0.08, "sustainLevel": 0.2, "releaseSeconds": 0.12, "frequencyHz": 740, "gain": 0.2 },
      "pearlShield": { "kind": "tone", "attackSeconds": 0.005, "decaySeconds": 0.12, "sustainLevel": 0.24, "releaseSeconds": 0.18, "frequencyHz": 520, "gain": 0.18 },
      "pearlDamaged": { "kind": "noise", "attackSeconds": 0.005, "decaySeconds": 0.1, "sustainLevel": 0.12, "releaseSeconds": 0.16, "frequencyHz": 180, "gain": 0.22 },
      "interaction": { "kind": "tone", "attackSeconds": 0.005, "decaySeconds": 0.14, "sustainLevel": 0.18, "releaseSeconds": 0.2, "frequencyHz": 310, "gain": 0.18 },
      "warningOne": { "kind": "tone", "attackSeconds": 0.01, "decaySeconds": 0.18, "sustainLevel": 0.32, "releaseSeconds": 0.25, "frequencyHz": 260, "gain": 0.22 },
      "warningTwo": { "kind": "tone", "attackSeconds": 0.005, "decaySeconds": 0.16, "sustainLevel": 0.4, "releaseSeconds": 0.3, "frequencyHz": 190, "gain": 0.28 },
      "failure": { "kind": "noise", "attackSeconds": 0.01, "decaySeconds": 0.45, "sustainLevel": 0.3, "releaseSeconds": 0.8, "frequencyHz": 70, "gain": 0.36 }
    }
  },
  "accessibility": {
    "reducedMotionFailureDurationSeconds": 1,
    "reducedMotionCameraMultiplier": 0
  },
  "performance": {
    "particlePoolSize": 320,
    "steamPoolSize": 96,
    "pearlPoolSize": 128,
    "effectPoolInitialCapacity": 640,
    "effectPoolMaximumCapacity": 1024
  }
}
